{
  "schema_version": "track-v1",
  "track_id": "test_008",
  "name": "Test 008",
  "split": "test",
  "width_m": 12.0,
  "centerline": [
    [
      95.381412,
      10.625616
    ],
    [
      95.974309,
      14.555894
    ],
    [
      96.358023,
      18.512054
    ],
    [
      96.523897,
      22.483273
    ],
    [
      96.457607,
      26.457323
    ],
    [
      96.140168,
      30.419102
    ],
    [
      95.547015,
      34.348893
    ],
    [
      94.648138,
      38.219963
    ],
    [
      93.409434,
      41.995665
    ],
    [
      91.797344,
      45.627159
    ],
    [
      89.806263,
      49.065805
    ],
    [
      87.517578,
      52.314757
    ],
    [
      85.000927,
      55.390916
    ],
    [
      82.296487,
      58.30357
    ],
    [
      79.431085,
      61.058112
    ],
    [
      76.41979,
      63.652406
    ],
    [
      73.269915,
      66.076515
    ],
    [
      69.984095,
      68.312704
    ],
    [
      66.559415,
      70.329387
    ],
    [
      62.985479,
      72.066079
    ],
    [
      59.199077,
      73.261657
    ],
    [
      55.28188,
      73.924754
    ],
    [
      51.318312,
      74.215831
    ],
    [
      47.343821,
      74.271717
    ],
    [
      43.369149,
      74.209843
    ],
    [
      39.394665,
      74.135417
    ],
    [
      35.419831,
      74.160628
    ],
    [
      31.454464,
      74.423501
    ],
    [
      27.543188,
      75.114713
    ],
    [
      23.799946,
      76.437754
    ],
    [
      20.300744,
      78.317958
    ],
    [
      17.011266,
      80.548194
    ],
    [
      13.82565,
      82.925936
    ],
    [
      10.601461,
      85.250452
    ],
    [
      7.187587,
      87.281555
    ],
    [
      3.482408,
      88.700215
    ],
    [
      -0.449835,
      89.216307
    ],
    [
      -4.4172,
      89.027678
    ],
    [
      -8.335418,
      88.367111
    ],
    [
      -12.186316,
      87.383957
    ],
    [
      -15.977589,
      86.189843
    ],
    [
      -19.726557,
      84.868238
    ],
    [
      -23.453128,
      83.484479
    ],
    [
      -27.177606,
      82.095074
    ],
    [
      -30.919615,
      80.753787
    ],
    [
      -34.692399,
      79.501729
    ],
    [
      -38.48341,
      78.305742
    ],
    [
      -42.276364,
      77.11591
    ],
    [
      -46.057669,
      75.889673
    ],
    [
      -49.813096,
      74.586558
    ],
    [
      -53.526128,
      73.167479
    ],
    [
      -57.174352,
      71.589705
    ],
    [
      -60.727842,
      69.809395
    ],
    [
      -64.142998,
      67.777099
    ],
    [
      -67.363637,
      65.449606
    ],
    [
      -70.391129,
      62.874584
    ],
    [
      -73.258147,
      60.121696
    ],
    [
      -75.980321,
      57.225356
    ],
    [
      -78.566034,
      54.206475
    ],
    [
      -81.018773,
      51.078549
    ],
    [
      -83.336143,
      47.849056
    ],
    [
      -85.51093,
      44.521925
    ],
    [
      -87.526898,
      41.096329
    ],
    [
      -89.354016,
      37.566579
    ],
    [
      -90.941893,
      33.923258
    ],
    [
      -92.263243,
      30.175083
    ],
    [
      -93.287861,
      26.335389
    ],
    [
      -93.981114,
      22.422445
    ],
    [
      -94.316607,
      18.462861
    ],
    [
      -94.283069,
      14.489261
    ],
    [
      -93.886158,
      10.535306
    ],
    [
      -93.145827,
      6.630873
    ],
    [
      -92.03612,
      2.817267
    ],
    [
      -90.327559,
      -0.768154
    ],
    [
      -88.232182,
      -4.144867
    ],
    [
      -85.928088,
      -7.383781
    ],
    [
      -83.52366,
      -10.549295
    ],
    [
      -81.097783,
      -13.698472
    ],
    [
      -78.723711,
      -16.886716
    ],
    [
      -76.487435,
      -20.17255
    ],
    [
      -74.516336,
      -23.622607
    ],
    [
      -73.023603,
      -27.301575
    ],
    [
      -72.372474,
      -31.211776
    ],
    [
      -72.629094,
      -35.172322
    ],
    [
      -73.480254,
      -39.053232
    ],
    [
      -74.60699,
      -42.865173
    ],
    [
      -75.735005,
      -46.676742
    ],
    [
      -76.578472,
      -50.559137
    ],
    [
      -76.779686,
      -54.521555
    ],
    [
      -75.973325,
      -58.399385
    ],
    [
      -74.286531,
      -61.995938
    ],
    [
      -72.266674,
      -65.418582
    ],
    [
      -70.01447,
      -68.693396
    ],
    [
      -67.570097,
      -71.827553
    ],
    [
      -64.954465,
      -74.820298
    ],
    [
      -62.176731,
      -77.663181
    ],
    [
      -59.237702,
      -80.338885
    ],
    [
      -56.131253,
      -82.81797
    ],
    [
      -52.849126,
      -85.058677
    ],
    [
      -49.379613,
      -86.995427
    ],
    [
      -45.715745,
      -88.530771
    ],
    [
      -41.894439,
      -89.619353
    ],
    [
      -37.987888,
      -90.348941
    ],
    [
      -34.038,
      -90.790506
    ],
    [
      -30.068801,
      -90.999738
    ],
    [
      -26.09397,
      -91.011658
    ],
    [
      -22.122131,
      -90.85511
    ],
    [
      -18.158959,
      -90.548898
    ],
    [
      -14.208842,
      -90.104702
    ],
    [
      -10.275292,
      -89.532003
    ],
    [
      -6.362377,
      -88.832091
    ],
    [
      -2.475069,
      -88.001801
    ],
    [
      1.337721,
      -86.885968
    ],
    [
      5.001167,
      -85.34734
    ],
    [
      8.513346,
      -83.48753
    ],
    [
      11.901611,
      -81.409446
    ],
    [
      15.209283,
      -79.204747
    ],
    [
      18.489687,
      -76.959494
    ],
    [
      21.799416,
      -74.757914
    ],
    [
      25.19587,
      -72.693409
    ],
    [
      28.729606,
      -70.875587
    ],
    [
      32.431756,
      -69.434466
    ],
    [
      36.307242,
      -68.570203
    ],
    [
      40.265781,
      -68.227844
    ],
    [
      44.240339,
      -68.214507
    ],
    [
      48.212177,
      -68.374932
    ],
    [
      52.182046,
      -68.580634
    ],
    [
      56.155125,
      -68.701908
    ],
    [
      60.127063,
      -68.577247
    ],
    [
      64.049992,
      -67.963872
    ],
    [
      67.734469,
      -66.50768
    ],
    [
      70.721468,
      -63.91952
    ],
    [
      72.747122,
      -60.512141
    ],
    [
      74.056832,
      -56.762888
    ],
    [
      74.925042,
      -52.884987
    ],
    [
      75.52981,
      -48.956495
    ],
    [
      75.989111,
      -45.00803
    ],
    [
      76.386938,
      -41.052792
    ],
    [
      76.795362,
      -37.09865
    ],
    [
      77.287029,
      -33.154139
    ],
    [
      77.945918,
      -29.234463
    ],
    [
      78.888824,
      -25.374184
    ],
    [
      80.221144,
      -21.630439
    ],
    [
      81.831319,
      -17.996701
    ],
    [
      83.634633,
      -14.454425
    ],
    [
      85.557437,
      -10.975311
    ],
    [
      87.531301,
      -7.524798
    ],
    [
      89.487607,
      -4.064341
    ],
    [
      91.351601,
      -0.553533
    ],
    [
      93.033578,
      3.047529
    ],
    [
      94.421667,
      6.770875
    ]
  ],
  "checkpoints": [
    {
      "index": 0,
      "s_m": 0.0
    },
    {
      "index": 1,
      "s_m": 54.54603507907989
    },
    {
      "index": 2,
      "s_m": 109.09207015815979
    },
    {
      "index": 3,
      "s_m": 163.63810523723967
    },
    {
      "index": 4,
      "s_m": 218.18414031631957
    },
    {
      "index": 5,
      "s_m": 272.73017539539944
    },
    {
      "index": 6,
      "s_m": 327.27621047447934
    },
    {
      "index": 7,
      "s_m": 381.8222455535593
    },
    {
      "index": 8,
      "s_m": 436.36828063263914
    },
    {
      "index": 9,
      "s_m": 490.91431571171904
    },
    {
      "index": 10,
      "s_m": 545.4603507907989
    }
  ],
  "spawns": [
    {
      "spawn_id": "solo",
      "s_m": 595.0063858698788,
      "lateral_m": 0.0
    },
    {
      "spawn_id": "grid_left",
      "s_m": 595.0063858698788,
      "lateral_m": -1.5
    },
    {
      "spawn_id": "grid_right",
      "s_m": 595.0063858698788,
      "lateral_m": 1.5
    }
  ],
  "generator": {
    "version": "generator-v1",
    "seed": 30008,
    "attempt": 0,
    "config_hash": "91aa6945ffbf4c9e668a7c955fbc2aa8afeab591c3a0800737b9c7d16a2c6e90"
  }
}
