{
  "schema_version": "track-v1",
  "track_id": "train_047",
  "name": "Train 047",
  "split": "train",
  "width_m": 12.0,
  "centerline": [
    [
      102.702484,
      8.24216
    ],
    [
      102.702502,
      12.212449
    ],
    [
      101.75088,
      16.07257
    ],
    [
      100.168726,
      19.724353
    ],
    [
      98.212055,
      23.19215
    ],
    [
      96.052423,
      26.538244
    ],
    [
      93.809226,
      29.829227
    ],
    [
      91.581773,
      33.130829
    ],
    [
      89.477784,
      36.511941
    ],
    [
      87.645232,
      40.046073
    ],
    [
      86.161715,
      43.741184
    ],
    [
      84.904344,
      47.519935
    ],
    [
      83.759294,
      51.334541
    ],
    [
      82.612807,
      55.14871
    ],
    [
      81.3447,
      58.923801
    ],
    [
      79.822715,
      62.602866
    ],
    [
      77.902597,
      66.088695
    ],
    [
      75.458342,
      69.226177
    ],
    [
      72.465929,
      71.845576
    ],
    [
      69.091156,
      73.954682
    ],
    [
      65.495873,
      75.66482
    ],
    [
      61.778512,
      77.092632
    ],
    [
      57.995212,
      78.33658
    ],
    [
      54.179733,
      79.478672
    ],
    [
      50.354984,
      80.589503
    ],
    [
      46.540676,
      81.735487
    ],
    [
      42.758784,
      82.983736
    ],
    [
      39.042983,
      84.415497
    ],
    [
      35.412365,
      86.052194
    ],
    [
      31.833127,
      87.798969
    ],
    [
      28.268258,
      89.575021
    ],
    [
      24.682461,
      91.308243
    ],
    [
      21.042352,
      92.923701
    ],
    [
      17.318684,
      94.334595
    ],
    [
      13.49182,
      95.43208
    ],
    [
      9.565335,
      96.081032
    ],
    [
      5.587611,
      96.130052
    ],
    [
      1.671628,
      95.439517
    ],
    [
      -2.084962,
      94.125092
    ],
    [
      -5.68118,
      92.416245
    ],
    [
      -9.148612,
      90.457836
    ],
    [
      -12.524378,
      88.34475
    ],
    [
      -15.842565,
      86.142064
    ],
    [
      -19.136672,
      83.903427
    ],
    [
      -22.441627,
      81.680886
    ],
    [
      -25.798547,
      79.537979
    ],
    [
      -29.260591,
      77.570693
    ],
    [
      -32.899845,
      75.96026
    ],
    [
      -36.746019,
      74.946367
    ],
    [
      -40.710575,
      74.614971
    ],
    [
      -44.691003,
      74.735287
    ],
    [
      -48.671727,
      74.746137
    ],
    [
      -52.591579,
      74.085484
    ],
    [
      -56.282971,
      72.608135
    ],
    [
      -59.68958,
      70.548885
    ],
    [
      -63.006883,
      68.344842
    ],
    [
      -66.286765,
      66.085496
    ],
    [
      -69.525634,
      63.767756
    ],
    [
      -72.718311,
      61.386818
    ],
    [
      -75.857138,
      58.935364
    ],
    [
      -78.932305,
      56.404571
    ],
    [
      -81.929292,
      53.78174
    ],
    [
      -84.826121,
      51.04885
    ],
    [
      -87.593042,
      48.184771
    ],
    [
      -90.17667,
      45.154851
    ],
    [
      -92.49035,
      41.915313
    ],
    [
      -94.364455,
      38.406166
    ],
    [
      -95.447566,
      34.587833
    ],
    [
      -95.247973,
      30.627253
    ],
    [
      -94.042435,
      26.83822
    ],
    [
      -92.257467,
      23.280487
    ],
    [
      -90.149157,
      19.902541
    ],
    [
      -87.858344,
      16.644853
    ],
    [
      -85.475627,
      13.453478
    ],
    [
      -83.069885,
      10.279357
    ],
    [
      -80.708226,
      7.072443
    ],
    [
      -78.476372,
      3.774407
    ],
    [
      -76.514935,
      0.310429
    ],
    [
      -75.109908,
      -3.408141
    ],
    [
      -74.757377,
      -7.359942
    ],
    [
      -75.537786,
      -11.253551
    ],
    [
      -77.166336,
      -14.882548
    ],
    [
      -79.245065,
      -18.278529
    ],
    [
      -81.453455,
      -21.592967
    ],
    [
      -83.511162,
      -25.001455
    ],
    [
      -85.076228,
      -28.657131
    ],
    [
      -85.718327,
      -32.573713
    ],
    [
      -85.256115,
      -36.52118
    ],
    [
      -84.252475,
      -40.373755
    ],
    [
      -82.934762,
      -44.131355
    ],
    [
      -81.389198,
      -47.801479
    ],
    [
      -79.666445,
      -51.392041
    ],
    [
      -77.795915,
      -54.907976
    ],
    [
      -75.798973,
      -58.35373
    ],
    [
      -73.685667,
      -61.729392
    ],
    [
      -71.462637,
      -65.03383
    ],
    [
      -69.129129,
      -68.261174
    ],
    [
      -66.679642,
      -71.40133
    ],
    [
      -64.107702,
      -74.442045
    ],
    [
      -61.43932,
      -77.398575
    ],
    [
      -58.679594,
      -80.270011
    ],
    [
      -55.825577,
      -83.047711
    ],
    [
      -52.870154,
      -85.717172
    ],
    [
      -49.803882,
      -88.258364
    ],
    [
      -46.612355,
      -90.640052
    ],
    [
      -43.276628,
      -92.814576
    ],
    [
      -39.77437,
      -94.70791
    ],
    [
      -36.082681,
      -96.194689
    ],
    [
      -32.201916,
      -97.057293
    ],
    [
      -28.24731,
      -96.773091
    ],
    [
      -24.506988,
      -95.428204
    ],
    [
      -21.031072,
      -93.488428
    ],
    [
      -17.715301,
      -91.28265
    ],
    [
      -14.440014,
      -89.01659
    ],
    [
      -11.097076,
      -86.852464
    ],
    [
      -7.592652,
      -84.963974
    ],
    [
      -3.868102,
      -83.56644
    ],
    [
      0.051395,
      -82.905495
    ],
    [
      4.029316,
      -82.992743
    ],
    [
      7.971969,
      -83.547002
    ],
    [
      11.867494,
      -84.373866
    ],
    [
      15.727349,
      -85.35524
    ],
    [
      19.568851,
      -86.406622
    ],
    [
      23.410334,
      -87.458076
    ],
    [
      27.270942,
      -88.436421
    ],
    [
      31.169132,
      -89.250195
    ],
    [
      35.117775,
      -89.75652
    ],
    [
      39.094302,
      -89.705199
    ],
    [
      42.927166,
      -88.678236
    ],
    [
      46.369934,
      -86.695061
    ],
    [
      49.29225,
      -83.998572
    ],
    [
      51.728825,
      -80.85202
    ],
    [
      53.809536,
      -77.457327
    ],
    [
      55.674725,
      -73.938634
    ],
    [
      57.444267,
      -70.370554
    ],
    [
      59.221123,
      -66.80613
    ],
    [
      61.097244,
      -63.293205
    ],
    [
      62.996737,
      -59.793141
    ],
    [
      64.716131,
      -56.200948
    ],
    [
      66.309482,
      -52.550898
    ],
    [
      67.825148,
      -48.867817
    ],
    [
      69.303503,
      -45.169562
    ],
    [
      70.780461,
      -41.470747
    ],
    [
      72.289702,
      -37.785017
    ],
    [
      73.864624,
      -34.126935
    ],
    [
      75.540016,
      -30.513873
    ],
    [
      77.353398,
      -26.968235
    ],
    [
      79.362731,
      -23.53072
    ],
    [
      81.670405,
      -20.286015
    ],
    [
      84.188334,
      -17.200751
    ],
    [
      86.830226,
      -14.220513
    ],
    [
      89.533031,
      -11.29522
    ],
    [
      92.241487,
      -8.375143
    ],
    [
      94.898998,
      -5.408793
    ],
    [
      97.432309,
      -2.336183
    ],
    [
      99.729708,
      0.915294
    ],
    [
      101.59924,
      4.426959
    ]
  ],
  "checkpoints": [
    {
      "index": 0,
      "s_m": 0.0
    },
    {
      "index": 1,
      "s_m": 56.81212458382194
    },
    {
      "index": 2,
      "s_m": 113.62424916764388
    },
    {
      "index": 3,
      "s_m": 170.43637375146582
    },
    {
      "index": 4,
      "s_m": 227.24849833528776
    },
    {
      "index": 5,
      "s_m": 284.0606229191097
    },
    {
      "index": 6,
      "s_m": 340.87274750293165
    },
    {
      "index": 7,
      "s_m": 397.68487208675356
    },
    {
      "index": 8,
      "s_m": 454.4969966705755
    },
    {
      "index": 9,
      "s_m": 511.3091212543975
    },
    {
      "index": 10,
      "s_m": 568.1212458382194
    }
  ],
  "spawns": [
    {
      "spawn_id": "solo",
      "s_m": 619.9333704220413,
      "lateral_m": 0.0
    },
    {
      "spawn_id": "grid_left",
      "s_m": 619.9333704220413,
      "lateral_m": -1.5
    },
    {
      "spawn_id": "grid_right",
      "s_m": 619.9333704220413,
      "lateral_m": 1.5
    }
  ],
  "generator": {
    "version": "generator-v1",
    "seed": 10047,
    "attempt": 2,
    "config_hash": "91aa6945ffbf4c9e668a7c955fbc2aa8afeab591c3a0800737b9c7d16a2c6e90"
  }
}
