{
  "schema_version": "track-v1",
  "track_id": "validation_014",
  "name": "Validation 014",
  "split": "validation",
  "width_m": 12.0,
  "centerline": [
    [
      95.43587,
      3.696338
    ],
    [
      96.505337,
      7.530802
    ],
    [
      97.314112,
      11.428449
    ],
    [
      97.840285,
      15.374079
    ],
    [
      98.066652,
      19.348126
    ],
    [
      97.98657,
      23.327812
    ],
    [
      97.601819,
      27.289718
    ],
    [
      96.92669,
      31.212667
    ],
    [
      95.983277,
      35.080019
    ],
    [
      94.800048,
      38.881076
    ],
    [
      93.422089,
      42.616056
    ],
    [
      91.85776,
      46.276877
    ],
    [
      90.107118,
      49.852322
    ],
    [
      88.167463,
      53.328813
    ],
    [
      86.035566,
      56.690772
    ],
    [
      83.707885,
      59.920181
    ],
    [
      81.181779,
      62.996774
    ],
    [
      78.454692,
      65.896582
    ],
    [
      75.529334,
      68.59607
    ],
    [
      72.419375,
      71.080942
    ],
    [
      69.176117,
      73.389706
    ],
    [
      65.835492,
      75.555442
    ],
    [
      62.418214,
      77.598196
    ],
    [
      58.93594,
      79.528128
    ],
    [
      55.395711,
      81.349599
    ],
    [
      51.801436,
      83.061951
    ],
    [
      48.154681,
      84.659452
    ],
    [
      44.455095,
      86.130357
    ],
    [
      40.700678,
      87.454789
    ],
    [
      36.88816,
      88.600754
    ],
    [
      33.012461,
      89.508825
    ],
    [
      29.067011,
      90.012452
    ],
    [
      25.092642,
      89.866811
    ],
    [
      21.17989,
      89.145742
    ],
    [
      17.366397,
      88.005976
    ],
    [
      13.635279,
      86.617348
    ],
    [
      9.937059,
      85.142422
    ],
    [
      6.209232,
      83.744937
    ],
    [
      2.394239,
      82.611127
    ],
    [
      -1.529611,
      81.959906
    ],
    [
      -5.505136,
      82.002537
    ],
    [
      -9.423941,
      82.688003
    ],
    [
      -13.249636,
      83.787226
    ],
    [
      -17.01818,
      85.071655
    ],
    [
      -20.794649,
      86.332239
    ],
    [
      -24.63883,
      87.363914
    ],
    [
      -28.572777,
      87.955927
    ],
    [
      -32.548693,
      87.912648
    ],
    [
      -36.449902,
      87.145848
    ],
    [
      -40.216228,
      85.859619
    ],
    [
      -43.870334,
      84.28037
    ],
    [
      -47.431245,
      82.500161
    ],
    [
      -50.915353,
      80.573667
    ],
    [
      -54.334212,
      78.533461
    ],
    [
      -57.696554,
      76.401312
    ],
    [
      -61.008824,
      74.192126
    ],
    [
      -64.275647,
      71.916243
    ],
    [
      -67.500153,
      69.580774
    ],
    [
      -70.684123,
      67.190328
    ],
    [
      -73.827513,
      64.746768
    ],
    [
      -76.92614,
      62.246737
    ],
    [
      -79.938145,
      59.643332
    ],
    [
      -82.83163,
      56.908906
    ],
    [
      -85.58831,
      54.036706
    ],
    [
      -88.192217,
      51.025369
    ],
    [
      -90.633402,
      47.880664
    ],
    [
      -92.911321,
      44.615679
    ],
    [
      -95.036892,
      41.24941
    ],
    [
      -97.031271,
      37.803667
    ],
    [
      -99.000657,
      34.343557
    ],
    [
      -101.039303,
      30.923592
    ],
    [
      -103.031694,
      27.476651
    ],
    [
      -104.854747,
      23.937888
    ],
    [
      -106.369682,
      20.257892
    ],
    [
      -107.418223,
      16.420563
    ],
    [
      -107.850161,
      12.467544
    ],
    [
      -107.578575,
      8.500743
    ],
    [
      -106.621611,
      4.641265
    ],
    [
      -105.110019,
      0.960262
    ],
    [
      -103.270986,
      -2.570076
    ],
    [
      -101.22795,
      -5.986944
    ],
    [
      -99.047288,
      -9.317908
    ],
    [
      -96.770117,
      -12.583783
    ],
    [
      -94.42323,
      -15.799987
    ],
    [
      -92.028275,
      -18.980595
    ],
    [
      -89.601145,
      -22.136741
    ],
    [
      -87.157944,
      -25.280472
    ],
    [
      -84.714954,
      -28.424367
    ],
    [
      -82.293318,
      -31.584717
    ],
    [
      -79.925313,
      -34.785352
    ],
    [
      -77.607124,
      -38.022341
    ],
    [
      -75.240281,
      -41.223898
    ],
    [
      -72.820505,
      -44.38564
    ],
    [
      -70.352704,
      -47.510059
    ],
    [
      -67.849525,
      -50.606231
    ],
    [
      -65.330783,
      -53.689772
    ],
    [
      -62.820566,
      -56.780248
    ],
    [
      -60.341341,
      -59.895614
    ],
    [
      -57.922604,
      -63.057901
    ],
    [
      -55.685764,
      -66.351026
    ],
    [
      -53.5874,
      -69.734535
    ],
    [
      -51.541443,
      -73.150135
    ],
    [
      -49.466999,
      -76.548429
    ],
    [
      -47.283252,
      -79.8772
    ],
    [
      -44.906801,
      -83.070531
    ],
    [
      -42.253123,
      -86.036137
    ],
    [
      -39.251683,
      -88.646932
    ],
    [
      -35.889986,
      -90.77339
    ],
    [
      -32.28983,
      -92.469336
    ],
    [
      -28.549453,
      -93.830702
    ],
    [
      -24.723284,
      -94.929699
    ],
    [
      -20.843074,
      -95.820348
    ],
    [
      -16.928728,
      -96.547186
    ],
    [
      -12.992205,
      -97.142943
    ],
    [
      -9.041629,
      -97.637476
    ],
    [
      -5.082397,
      -98.057536
    ],
    [
      -1.118552,
      -98.43188
    ],
    [
      2.849314,
      -98.76036
    ],
    [
      6.824197,
      -98.986215
    ],
    [
      10.804881,
      -99.039074
    ],
    [
      14.781441,
      -98.856143
    ],
    [
      18.735754,
      -98.399074
    ],
    [
      22.648599,
      -97.667171
    ],
    [
      26.507197,
      -96.687986
    ],
    [
      30.309462,
      -95.507809
    ],
    [
      34.095844,
      -94.276717
    ],
    [
      37.872946,
      -93.0175
    ],
    [
      41.632508,
      -91.706925
    ],
    [
      45.366814,
      -90.326127
    ],
    [
      49.066854,
      -88.856104
    ],
    [
      52.720847,
      -87.275282
    ],
    [
      56.312078,
      -85.556922
    ],
    [
      59.815303,
      -83.666057
    ],
    [
      63.190437,
      -81.555769
    ],
    [
      66.366282,
      -79.157501
    ],
    [
      69.216495,
      -76.383147
    ],
    [
      71.483045,
      -73.122295
    ],
    [
      72.854909,
      -69.394754
    ],
    [
      73.452125,
      -65.462828
    ],
    [
      73.533934,
      -61.483947
    ],
    [
      73.309883,
      -57.509304
    ],
    [
      72.936251,
      -53.545462
    ],
    [
      72.53645,
      -49.584105
    ],
    [
      72.224307,
      -45.615105
    ],
    [
      72.120912,
      -41.63579
    ],
    [
      72.373199,
      -37.664351
    ],
    [
      73.158644,
      -33.765539
    ],
    [
      74.541267,
      -30.034832
    ],
    [
      76.318697,
      -26.47369
    ],
    [
      78.362851,
      -23.057782
    ],
    [
      80.581454,
      -19.752052
    ],
    [
      82.902512,
      -16.517199
    ],
    [
      85.268885,
      -13.315243
    ],
    [
      87.626108,
      -10.106568
    ],
    [
      89.915623,
      -6.849404
    ],
    [
      92.062191,
      -3.496731
    ],
    [
      93.95714,
      0.00329
    ]
  ],
  "checkpoints": [
    {
      "index": 0,
      "s_m": 0.0
    },
    {
      "index": 1,
      "s_m": 56.811556031669895
    },
    {
      "index": 2,
      "s_m": 113.62311206333979
    },
    {
      "index": 3,
      "s_m": 170.43466809500967
    },
    {
      "index": 4,
      "s_m": 227.24622412667958
    },
    {
      "index": 5,
      "s_m": 284.0577801583495
    },
    {
      "index": 6,
      "s_m": 340.86933619001934
    },
    {
      "index": 7,
      "s_m": 397.68089222168925
    },
    {
      "index": 8,
      "s_m": 454.49244825335916
    },
    {
      "index": 9,
      "s_m": 511.30400428502907
    },
    {
      "index": 10,
      "s_m": 568.115560316699
    }
  ],
  "spawns": [
    {
      "spawn_id": "solo",
      "s_m": 619.9271163483688,
      "lateral_m": 0.0
    },
    {
      "spawn_id": "grid_left",
      "s_m": 619.9271163483688,
      "lateral_m": -1.5
    },
    {
      "spawn_id": "grid_right",
      "s_m": 619.9271163483688,
      "lateral_m": 1.5
    }
  ],
  "generator": {
    "version": "generator-v1",
    "seed": 20014,
    "attempt": 0,
    "config_hash": "91aa6945ffbf4c9e668a7c955fbc2aa8afeab591c3a0800737b9c7d16a2c6e90"
  }
}
