{
  "schema_version": "track-v1",
  "track_id": "fixture_validation",
  "name": "Reference fixture (manual)",
  "split": "validation",
  "width_m": 12.0,
  "centerline": [
    [
      107.12,
      0.0
    ],
    [
      106.9565,
      3.976947
    ],
    [
      106.4683,
      7.927213
    ],
    [
      105.661785,
      11.824993
    ],
    [
      104.547213,
      15.646148
    ],
    [
      103.138177,
      19.368852
    ],
    [
      101.450921,
      22.974064
    ],
    [
      99.503833,
      26.445911
    ],
    [
      97.316556,
      29.771754
    ],
    [
      94.909449,
      32.942211
    ],
    [
      92.303033,
      35.951051
    ],
    [
      89.517602,
      38.795071
    ],
    [
      86.572988,
      41.47404
    ],
    [
      83.48819,
      43.990424
    ],
    [
      80.281341,
      46.349412
    ],
    [
      76.969701,
      48.558995
    ],
    [
      73.569555,
      50.629927
    ],
    [
      70.096395,
      52.576053
    ],
    [
      66.56506,
      54.414641
    ],
    [
      62.989913,
      56.166637
    ],
    [
      59.385216,
      57.857103
    ],
    [
      55.765518,
      59.515267
    ],
    [
      52.146085,
      61.174007
    ],
    [
      48.54315,
      62.868208
    ],
    [
      44.973546,
      64.631424
    ],
    [
      41.453222,
      66.490955
    ],
    [
      37.994387,
      68.462438
    ],
    [
      34.602112,
      70.546396
    ],
    [
      31.272119,
      72.728593
    ],
    [
      27.991186,
      74.983988
    ],
    [
      24.739922,
      77.282017
    ],
    [
      21.496361,
      79.590925
    ],
    [
      18.239015,
      81.880313
    ],
    [
      14.948799,
      84.122137
    ],
    [
      11.609963,
      86.29079
    ],
    [
      8.210328,
      88.36272
    ],
    [
      4.741265,
      90.316056
    ],
    [
      1.197444,
      92.130091
    ],
    [
      -2.423305,
      93.785099
    ],
    [
      -6.120231,
      95.261951
    ],
    [
      -9.889704,
      96.542136
    ],
    [
      -13.725281,
      97.607789
    ],
    [
      -17.617784,
      98.441534
    ],
    [
      -21.555198,
      99.027124
    ],
    [
      -25.522787,
      99.349365
    ],
    [
      -29.503116,
      99.394629
    ],
    [
      -33.4762,
      99.151436
    ],
    [
      -37.419788,
      98.610924
    ],
    [
      -41.309769,
      97.767326
    ],
    [
      -45.12073,
      96.618482
    ],
    [
      -48.826653,
      95.166189
    ],
    [
      -52.40169,
      93.416339
    ],
    [
      -55.821146,
      91.379153
    ],
    [
      -59.0622,
      89.068644
    ],
    [
      -62.104677,
      86.502243
    ],
    [
      -64.931583,
      83.700102
    ],
    [
      -67.529586,
      80.684453
    ],
    [
      -69.889143,
      77.478725
    ],
    [
      -72.004426,
      74.106742
    ],
    [
      -73.873179,
      70.592059
    ],
    [
      -75.496423,
      66.957383
    ],
    [
      -76.878062,
      63.224098
    ],
    [
      -78.024809,
      59.41203
    ],
    [
      -78.945529,
      55.539084
    ],
    [
      -79.651271,
      51.621187
    ],
    [
      -80.15494,
      47.672156
    ],
    [
      -80.471416,
      43.703669
    ],
    [
      -80.617513,
      39.725199
    ],
    [
      -80.612209,
      35.743986
    ],
    [
      -80.476888,
      31.765008
    ],
    [
      -80.235852,
      27.790976
    ],
    [
      -79.916748,
      23.822401
    ],
    [
      -79.550881,
      19.857832
    ],
    [
      -79.173273,
      15.894354
    ],
    [
      -78.821744,
      11.9285
    ],
    [
      -78.53453,
      7.95752
    ],
    [
      -78.34585,
      3.980703
    ],
    [
      -78.28,
      -0.0
    ],
    [
      -78.34585,
      -3.980703
    ],
    [
      -78.53453,
      -7.95752
    ],
    [
      -78.821744,
      -11.9285
    ],
    [
      -79.173273,
      -15.894354
    ],
    [
      -79.550881,
      -19.857832
    ],
    [
      -79.916748,
      -23.822401
    ],
    [
      -80.235852,
      -27.790976
    ],
    [
      -80.476888,
      -31.765008
    ],
    [
      -80.612209,
      -35.743986
    ],
    [
      -80.617513,
      -39.725199
    ],
    [
      -80.471416,
      -43.703669
    ],
    [
      -80.15494,
      -47.672156
    ],
    [
      -79.651271,
      -51.621187
    ],
    [
      -78.945529,
      -55.539084
    ],
    [
      -78.024809,
      -59.41203
    ],
    [
      -76.878062,
      -63.224098
    ],
    [
      -75.496423,
      -66.957383
    ],
    [
      -73.873179,
      -70.592059
    ],
    [
      -72.004426,
      -74.106742
    ],
    [
      -69.889143,
      -77.478725
    ],
    [
      -67.529586,
      -80.684453
    ],
    [
      -64.931583,
      -83.700102
    ],
    [
      -62.104677,
      -86.502243
    ],
    [
      -59.0622,
      -89.068644
    ],
    [
      -55.821146,
      -91.379153
    ],
    [
      -52.40169,
      -93.416339
    ],
    [
      -48.826653,
      -95.166189
    ],
    [
      -45.12073,
      -96.618482
    ],
    [
      -41.309769,
      -97.767326
    ],
    [
      -37.419788,
      -98.610924
    ],
    [
      -33.4762,
      -99.151436
    ],
    [
      -29.503116,
      -99.394629
    ],
    [
      -25.522787,
      -99.349365
    ],
    [
      -21.555198,
      -99.027124
    ],
    [
      -17.617784,
      -98.441534
    ],
    [
      -13.725281,
      -97.607789
    ],
    [
      -9.889704,
      -96.542136
    ],
    [
      -6.120231,
      -95.261951
    ],
    [
      -2.423305,
      -93.785099
    ],
    [
      1.197444,
      -92.130091
    ],
    [
      4.741265,
      -90.316056
    ],
    [
      8.210328,
      -88.36272
    ],
    [
      11.609963,
      -86.29079
    ],
    [
      14.948799,
      -84.122137
    ],
    [
      18.239015,
      -81.880313
    ],
    [
      21.496361,
      -79.590925
    ],
    [
      24.739922,
      -77.282017
    ],
    [
      27.991186,
      -74.983988
    ],
    [
      31.272119,
      -72.728593
    ],
    [
      34.602112,
      -70.546396
    ],
    [
      37.994387,
      -68.462438
    ],
    [
      41.453222,
      -66.490955
    ],
    [
      44.973546,
      -64.631424
    ],
    [
      48.54315,
      -62.868208
    ],
    [
      52.146085,
      -61.174007
    ],
    [
      55.765518,
      -59.515267
    ],
    [
      59.385216,
      -57.857103
    ],
    [
      62.989913,
      -56.166637
    ],
    [
      66.56506,
      -54.414641
    ],
    [
      70.096395,
      -52.576053
    ],
    [
      73.569555,
      -50.629927
    ],
    [
      76.969701,
      -48.558995
    ],
    [
      80.281341,
      -46.349412
    ],
    [
      83.48819,
      -43.990424
    ],
    [
      86.572988,
      -41.47404
    ],
    [
      89.517602,
      -38.795071
    ],
    [
      92.303033,
      -35.951051
    ],
    [
      94.909449,
      -32.942211
    ],
    [
      97.316556,
      -29.771754
    ],
    [
      99.503833,
      -26.445911
    ],
    [
      101.450921,
      -22.974064
    ],
    [
      103.138177,
      -19.368852
    ],
    [
      104.547213,
      -15.646148
    ],
    [
      105.661785,
      -11.824993
    ],
    [
      106.4683,
      -7.927213
    ],
    [
      106.9565,
      -3.976947
    ]
  ],
  "checkpoints": [
    {
      "index": 0,
      "s_m": 0.0
    },
    {
      "index": 1,
      "s_m": 55.73306718600452
    },
    {
      "index": 2,
      "s_m": 111.46613437200904
    },
    {
      "index": 3,
      "s_m": 167.19920155801356
    },
    {
      "index": 4,
      "s_m": 222.93226874401807
    },
    {
      "index": 5,
      "s_m": 278.6653359300226
    },
    {
      "index": 6,
      "s_m": 334.3984031160271
    },
    {
      "index": 7,
      "s_m": 390.13147030203163
    },
    {
      "index": 8,
      "s_m": 445.86453748803615
    },
    {
      "index": 9,
      "s_m": 501.59760467404067
    },
    {
      "index": 10,
      "s_m": 557.3306718600452
    }
  ],
  "spawns": [
    {
      "spawn_id": "solo",
      "s_m": 608.0637390460497,
      "lateral_m": 0.0
    },
    {
      "spawn_id": "grid_left",
      "s_m": 608.0637390460497,
      "lateral_m": -1.5
    },
    {
      "spawn_id": "grid_right",
      "s_m": 608.0637390460497,
      "lateral_m": 1.5
    }
  ],
  "generator": null
}
