{
  "schema_version": "track-v1",
  "track_id": "demo",
  "name": "Demo circuit",
  "split": "demo",
  "width_m": 12.0,
  "centerline": [
    [
      104.0,
      0.0
    ],
    [
      103.830483,
      3.990379
    ],
    [
      103.32436,
      7.952174
    ],
    [
      102.488699,
      11.8578
    ],
    [
      101.334822,
      15.681564
    ],
    [
      99.877686,
      19.400412
    ],
    [
      98.135137,
      22.994452
    ],
    [
      96.127111,
      26.447278
    ],
    [
      93.874876,
      29.746098
    ],
    [
      91.400343,
      32.881712
    ],
    [
      88.725508,
      35.848403
    ],
    [
      85.872012,
      38.643786
    ],
    [
      82.86078,
      41.268609
    ],
    [
      79.711852,
      43.726671
    ],
    [
      76.444244,
      46.024745
    ],
    [
      73.076012,
      48.172766
    ],
    [
      69.624166,
      50.183814
    ],
    [
      66.104933,
      52.074609
    ],
    [
      62.533886,
      53.865765
    ],
    [
      58.926336,
      55.582339
    ],
    [
      55.297693,
      57.253952
    ],
    [
      51.664022,
      58.914628
    ],
    [
      48.042391,
      60.601342
    ],
    [
      44.450763,
      62.350904
    ],
    [
      40.906664,
      64.194699
    ],
    [
      37.424315,
      66.152533
    ],
    [
      34.010715,
      68.227931
    ],
    [
      30.662771,
      70.40776
    ],
    [
      27.36729,
      72.666241
    ],
    [
      24.103888,
      74.970916
    ],
    [
      20.849095,
      77.287754
    ],
    [
      17.579877,
      79.584159
    ],
    [
      14.275863,
      81.830134
    ],
    [
      10.920383,
      83.99836
    ],
    [
      7.500738,
      86.063777
    ],
    [
      4.008119,
      88.0031
    ],
    [
      0.437373,
      89.794347
    ],
    [
      -3.213234,
      91.416468
    ],
    [
      -6.942193,
      92.849117
    ],
    [
      -10.744812,
      94.072677
    ],
    [
      -14.613359,
      95.068042
    ],
    [
      -18.536973,
      95.817065
    ],
    [
      -22.501745,
      96.302602
    ],
    [
      -26.490723,
      96.50901
    ],
    [
      -30.484029,
      96.42263
    ],
    [
      -34.459086,
      96.032356
    ],
    [
      -38.390995,
      95.330241
    ],
    [
      -42.253094,
      94.312085
    ],
    [
      -46.017679,
      92.977916
    ],
    [
      -49.656895,
      91.332314
    ],
    [
      -53.143696,
      89.38449
    ],
    [
      -56.452833,
      87.148094
    ],
    [
      -59.561738,
      84.640757
    ],
    [
      -62.451258,
      81.883401
    ],
    [
      -65.106144,
      78.899391
    ],
    [
      -67.515306,
      75.713617
    ],
    [
      -69.67182,
      72.351591
    ],
    [
      -71.572753,
      68.838643
    ],
    [
      -73.218853,
      65.199232
    ],
    [
      -74.614179,
      61.456419
    ],
    [
      -75.765693,
      57.631471
    ],
    [
      -76.682911,
      53.743602
    ],
    [
      -77.377796,
      49.809832
    ],
    [
      -77.864294,
      45.844819
    ],
    [
      -78.158519,
      41.860847
    ],
    [
      -78.278831,
      37.867766
    ],
    [
      -78.245935,
      33.872937
    ],
    [
      -78.083378,
      29.881214
    ],
    [
      -77.817981,
      25.894946
    ],
    [
      -77.480388,
      21.914093
    ],
    [
      -77.105383,
      17.936561
    ],
    [
      -76.731659,
      13.958909
    ],
    [
      -76.400301,
      9.977541
    ],
    [
      -76.151206,
      5.990246
    ],
    [
      -76.017224,
      1.997489
    ],
    [
      -76.017224,
      -1.997489
    ],
    [
      -76.151206,
      -5.990246
    ],
    [
      -76.400301,
      -9.977541
    ],
    [
      -76.731659,
      -13.958909
    ],
    [
      -77.105383,
      -17.936561
    ],
    [
      -77.480388,
      -21.914093
    ],
    [
      -77.817981,
      -25.894946
    ],
    [
      -78.083378,
      -29.881214
    ],
    [
      -78.245935,
      -33.872937
    ],
    [
      -78.278831,
      -37.867766
    ],
    [
      -78.158519,
      -41.860847
    ],
    [
      -77.864294,
      -45.844819
    ],
    [
      -77.377796,
      -49.809832
    ],
    [
      -76.682911,
      -53.743602
    ],
    [
      -75.765693,
      -57.631471
    ],
    [
      -74.614179,
      -61.456419
    ],
    [
      -73.218853,
      -65.199232
    ],
    [
      -71.572753,
      -68.838643
    ],
    [
      -69.67182,
      -72.351591
    ],
    [
      -67.515306,
      -75.713617
    ],
    [
      -65.106144,
      -78.899391
    ],
    [
      -62.451258,
      -81.883401
    ],
    [
      -59.561738,
      -84.640757
    ],
    [
      -56.452833,
      -87.148094
    ],
    [
      -53.143696,
      -89.38449
    ],
    [
      -49.656895,
      -91.332314
    ],
    [
      -46.017679,
      -92.977916
    ],
    [
      -42.253094,
      -94.312085
    ],
    [
      -38.390995,
      -95.330241
    ],
    [
      -34.459086,
      -96.032356
    ],
    [
      -30.484029,
      -96.42263
    ],
    [
      -26.490723,
      -96.50901
    ],
    [
      -22.501745,
      -96.302602
    ],
    [
      -18.536973,
      -95.817065
    ],
    [
      -14.613359,
      -95.068042
    ],
    [
      -10.744812,
      -94.072677
    ],
    [
      -6.942193,
      -92.849117
    ],
    [
      -3.213234,
      -91.416468
    ],
    [
      0.437373,
      -89.794347
    ],
    [
      4.008119,
      -88.0031
    ],
    [
      7.500738,
      -86.063777
    ],
    [
      10.920383,
      -83.99836
    ],
    [
      14.275863,
      -81.830134
    ],
    [
      17.579877,
      -79.584159
    ],
    [
      20.849095,
      -77.287754
    ],
    [
      24.103888,
      -74.970916
    ],
    [
      27.36729,
      -72.666241
    ],
    [
      30.662771,
      -70.40776
    ],
    [
      34.010715,
      -68.227931
    ],
    [
      37.424315,
      -66.152533
    ],
    [
      40.906664,
      -64.194699
    ],
    [
      44.450763,
      -62.350904
    ],
    [
      48.042391,
      -60.601342
    ],
    [
      51.664022,
      -58.914628
    ],
    [
      55.297693,
      -57.253952
    ],
    [
      58.926336,
      -55.582339
    ],
    [
      62.533886,
      -53.865765
    ],
    [
      66.104933,
      -52.074609
    ],
    [
      69.624166,
      -50.183814
    ],
    [
      73.076012,
      -48.172766
    ],
    [
      76.444244,
      -46.024745
    ],
    [
      79.711852,
      -43.726671
    ],
    [
      82.86078,
      -41.268609
    ],
    [
      85.872012,
      -38.643786
    ],
    [
      88.725508,
      -35.848403
    ],
    [
      91.400343,
      -32.881712
    ],
    [
      93.874876,
      -29.746098
    ],
    [
      96.127111,
      -26.447278
    ],
    [
      98.135137,
      -22.994452
    ],
    [
      99.877686,
      -19.400412
    ],
    [
      101.334822,
      -15.681564
    ],
    [
      102.488699,
      -11.8578
    ],
    [
      103.32436,
      -7.952174
    ],
    [
      103.830483,
      -3.990379
    ]
  ],
  "checkpoints": [
    {
      "index": 0,
      "s_m": 0.0
    },
    {
      "index": 1,
      "s_m": 59.52025085013347
    },
    {
      "index": 2,
      "s_m": 119.04050170026694
    },
    {
      "index": 3,
      "s_m": 178.56075255040042
    },
    {
      "index": 4,
      "s_m": 238.0810034005339
    },
    {
      "index": 5,
      "s_m": 297.60125425066735
    },
    {
      "index": 6,
      "s_m": 357.12150510080085
    },
    {
      "index": 7,
      "s_m": 416.6417559509343
    },
    {
      "index": 8,
      "s_m": 476.1620068010678
    },
    {
      "index": 9,
      "s_m": 535.6822576512012
    }
  ],
  "spawns": [
    {
      "spawn_id": "solo",
      "s_m": 590.2025085013347,
      "lateral_m": 0.0
    },
    {
      "spawn_id": "grid_left",
      "s_m": 590.2025085013347,
      "lateral_m": -1.5
    },
    {
      "spawn_id": "grid_right",
      "s_m": 590.2025085013347,
      "lateral_m": 1.5
    }
  ],
  "generator": null
}
