{
  "schema_version": "track-v1",
  "track_id": "fixture_test",
  "name": "Reference fixture (manual)",
  "split": "test",
  "width_m": 12.0,
  "centerline": [
    [
      100.88,
      0.0
    ],
    [
      100.706343,
      3.977174
    ],
    [
      100.188109,
      7.924277
    ],
    [
      99.332935,
      11.812357
    ],
    [
      98.152947,
      15.614532
    ],
    [
      96.664214,
      19.306831
    ],
    [
      94.885911,
      22.868799
    ],
    [
      92.839213,
      26.283714
    ],
    [
      90.54667,
      29.538787
    ],
    [
      88.031451,
      32.625144
    ],
    [
      85.316622,
      35.537581
    ],
    [
      82.424767,
      38.274445
    ],
    [
      79.377683,
      40.837485
    ],
    [
      76.196115,
      43.23168
    ],
    [
      72.899747,
      45.465315
    ],
    [
      69.507151,
      47.550042
    ],
    [
      66.035871,
      49.5011
    ],
    [
      62.502676,
      51.337813
    ],
    [
      58.923779,
      53.083951
    ],
    [
      55.315277,
      54.768176
    ],
    [
      51.693691,
      56.42414
    ],
    [
      48.076466,
      58.089587
    ],
    [
      44.482171,
      59.803845
    ],
    [
      40.929703,
      61.603019
    ],
    [
      37.435768,
      63.513252
    ],
    [
      34.010836,
      65.544589
    ],
    [
      30.65527,
      67.68866
    ],
    [
      27.358132,
      69.921671
    ],
    [
      24.099628,
      72.210794
    ],
    [
      20.855484,
      74.520262
    ],
    [
      17.60113,
      76.815295
    ],
    [
      14.314498,
      79.063783
    ],
    [
      10.977388,
      81.236537
    ],
    [
      7.5759,
      83.30692
    ],
    [
      4.100326,
      85.250213
    ],
    [
      0.54498,
      87.043227
    ],
    [
      -3.092159,
      88.663714
    ],
    [
      -6.809534,
      90.09033
    ],
    [
      -10.602232,
      91.302318
    ],
    [
      -14.46196,
      92.279715
    ],
    [
      -18.37711,
      93.003418
    ],
    [
      -22.332752,
      93.455513
    ],
    [
      -26.310674,
      93.619709
    ],
    [
      -30.289523,
      93.48208
    ],
    [
      -34.245092,
      93.031444
    ],
    [
      -38.150737,
      92.260085
    ],
    [
      -41.978098,
      91.164681
    ],
    [
      -45.697901,
      89.746456
    ],
    [
      -49.280914,
      88.011487
    ],
    [
      -52.699201,
      85.97106
    ],
    [
      -55.927063,
      83.641031
    ],
    [
      -58.941975,
      81.041282
    ],
    [
      -61.725294,
      78.194901
    ],
    [
      -64.262882,
      75.12735
    ],
    [
      -66.545033,
      71.865207
    ],
    [
      -68.566391,
      68.435263
    ],
    [
      -70.325973,
      64.863862
    ],
    [
      -71.826442,
      61.176004
    ],
    [
      -73.073785,
      57.39493
    ],
    [
      -74.076987,
      53.541798
    ],
    [
      -74.847593,
      49.635411
    ],
    [
      -75.399634,
      45.692115
    ],
    [
      -75.749285,
      41.725667
    ],
    [
      -75.91512,
      37.747213
    ],
    [
      -75.918224,
      33.76523
    ],
    [
      -75.782601,
      29.78548
    ],
    [
      -75.535667,
      25.811017
    ],
    [
      -75.208877,
      21.842265
    ],
    [
      -74.838106,
      17.877345
    ],
    [
      -74.46356,
      13.912776
    ],
    [
      -74.128311,
      9.944728
    ],
    [
      -73.874641,
      5.970698
    ],
    [
      -73.737646,
      1.991008
    ],
    [
      -73.737646,
      -1.991008
    ],
    [
      -73.874641,
      -5.970698
    ],
    [
      -74.128311,
      -9.944728
    ],
    [
      -74.46356,
      -13.912776
    ],
    [
      -74.838106,
      -17.877345
    ],
    [
      -75.208877,
      -21.842265
    ],
    [
      -75.535667,
      -25.811017
    ],
    [
      -75.782601,
      -29.78548
    ],
    [
      -75.918224,
      -33.76523
    ],
    [
      -75.91512,
      -37.747213
    ],
    [
      -75.749285,
      -41.725667
    ],
    [
      -75.399634,
      -45.692115
    ],
    [
      -74.847593,
      -49.635411
    ],
    [
      -74.076987,
      -53.541798
    ],
    [
      -73.073785,
      -57.39493
    ],
    [
      -71.826442,
      -61.176004
    ],
    [
      -70.325973,
      -64.863862
    ],
    [
      -68.566391,
      -68.435263
    ],
    [
      -66.545033,
      -71.865207
    ],
    [
      -64.262882,
      -75.12735
    ],
    [
      -61.725294,
      -78.194901
    ],
    [
      -58.941975,
      -81.041282
    ],
    [
      -55.927063,
      -83.641031
    ],
    [
      -52.699201,
      -85.97106
    ],
    [
      -49.280914,
      -88.011487
    ],
    [
      -45.697901,
      -89.746456
    ],
    [
      -41.978098,
      -91.164681
    ],
    [
      -38.150737,
      -92.260085
    ],
    [
      -34.245092,
      -93.031444
    ],
    [
      -30.289523,
      -93.48208
    ],
    [
      -26.310674,
      -93.619709
    ],
    [
      -22.332752,
      -93.455513
    ],
    [
      -18.37711,
      -93.003418
    ],
    [
      -14.46196,
      -92.279715
    ],
    [
      -10.602232,
      -91.302318
    ],
    [
      -6.809534,
      -90.09033
    ],
    [
      -3.092159,
      -88.663714
    ],
    [
      0.54498,
      -87.043227
    ],
    [
      4.100326,
      -85.250213
    ],
    [
      7.5759,
      -83.30692
    ],
    [
      10.977388,
      -81.236537
    ],
    [
      14.314498,
      -79.063783
    ],
    [
      17.60113,
      -76.815295
    ],
    [
      20.855484,
      -74.520262
    ],
    [
      24.099628,
      -72.210794
    ],
    [
      27.358132,
      -69.921671
    ],
    [
      30.65527,
      -67.68866
    ],
    [
      34.010836,
      -65.544589
    ],
    [
      37.435768,
      -63.513252
    ],
    [
      40.929703,
      -61.603019
    ],
    [
      44.482171,
      -59.803845
    ],
    [
      48.076466,
      -58.089587
    ],
    [
      51.693691,
      -56.42414
    ],
    [
      55.315277,
      -54.768176
    ],
    [
      58.923779,
      -53.083951
    ],
    [
      62.502676,
      -51.337813
    ],
    [
      66.035871,
      -49.5011
    ],
    [
      69.507151,
      -47.550042
    ],
    [
      72.899747,
      -45.465315
    ],
    [
      76.196115,
      -43.23168
    ],
    [
      79.377683,
      -40.837485
    ],
    [
      82.424767,
      -38.274445
    ],
    [
      85.316622,
      -35.537581
    ],
    [
      88.031451,
      -32.625144
    ],
    [
      90.54667,
      -29.538787
    ],
    [
      92.839213,
      -26.283714
    ],
    [
      94.885911,
      -22.868799
    ],
    [
      96.664214,
      -19.306831
    ],
    [
      98.152947,
      -15.614532
    ],
    [
      99.332935,
      -11.812357
    ],
    [
      100.188109,
      -7.924277
    ],
    [
      100.706343,
      -3.977174
    ]
  ],
  "checkpoints": [
    {
      "index": 0,
      "s_m": 0.0
    },
    {
      "index": 1,
      "s_m": 57.734217638743175
    },
    {
      "index": 2,
      "s_m": 115.46843527748635
    },
    {
      "index": 3,
      "s_m": 173.20265291622954
    },
    {
      "index": 4,
      "s_m": 230.9368705549727
    },
    {
      "index": 5,
      "s_m": 288.6710881937159
    },
    {
      "index": 6,
      "s_m": 346.4053058324591
    },
    {
      "index": 7,
      "s_m": 404.13952347120227
    },
    {
      "index": 8,
      "s_m": 461.8737411099454
    },
    {
      "index": 9,
      "s_m": 519.6079587486886
    }
  ],
  "spawns": [
    {
      "spawn_id": "solo",
      "s_m": 572.3421763874318,
      "lateral_m": 0.0
    },
    {
      "spawn_id": "grid_left",
      "s_m": 572.3421763874318,
      "lateral_m": -1.5
    },
    {
      "spawn_id": "grid_right",
      "s_m": 572.3421763874318,
      "lateral_m": 1.5
    }
  ],
  "generator": null
}
